Vocab,ไทย,Japanese,gosho number,
Miraculous Stories of Japan,เรื่องน่าพิศวงของประเทศญี่ปุ่น,,70,
Mihirakula,พระเจ้ามิหิรกุล,Daizoku-ō （大族王）: ,,
Mihirakula,พระเจ้ามิหิรกุล,Daizoku-ō（大族王）,66,
Mii-dera,วัดมิอิเดระ,Mii-dera （三井寺）,105 / 13,
Mikkaka,"พระมิกกกะ , พระมิจจกะ , พระมิจฉกะ",Mishaka （弥遮迦）: ,,
Mikkaka,"พระมิกกกะ , พระมิจจกะ , พระมิจฉกะ",Mishaka（弥遮迦）,,
Mikuni no Taifu （三国太夫）,,Mikuni no Taifu （三国太夫）,,
Milarepa (See Tibetan Buddhism),,Mirarēpa （ミラレーパ）: ,,
Milinda,,Miranda-ō （弥蘭陀王）: ,,
Milindapanha,,Mirindaō-monkyō （ミリンダ王問経）: ,,
military leader,ผู้นำนักรบ,,,
military leader Hsiang Yu,นายพลเซี่ยงหวี่,,"2, 30",
military official,นายทหาร,,61,
Mimosuso River,แม่น้ำมิโมซูโซ,,13,
Minamoto no Yoritomo,ท่านมินาโมโตะ โนะ โยริโตะโมะ,,16/30/32/55/105,
Minamoto no Yoshinaka,ท่านมินาโมโตะ โนะ โยชินากะ,,105,
"mind of lowly man, goatish in its desire",จิตของปุถุชนที่เต็มไปด้วยตัณหาราคะ,,13,
mind of resolve to be reborn in the Pure Land (See three kinds of mind),,ekō-hotsugan-shin （廻向発願心）: ,,
mind’s disturbances,จิตใจที่ฟุ้งซ่าน,Kongocho-kyo,7,
Ming-sheng,,Myōshō （明勝）: ,,
Ming-sheng,,Myōshō（明勝）,,
minister,เสนาบดี,,2,
minister Iruka (Soga no Iruka),เสนาบดีอิรูกะ,,257,
minister of Emperor,อำมาตย์,,258,
minister Pi Kan,มหาเสนาบดีปี่กาน,,30,
"ministers Varshakāra and Chandrakīrti, or like Sunakshatra and Girika",วัสสการพราหมณ์กับจันทรเกียรติ หรือภิกษุสุนักษัตรกับคีรีกะ,,62,
"Minobu Transfer Document, The",,Minobu-sōjō-sho （身延相承書）: ,,
"Minobu, Mount",,Minobu-san （身延山）: ,,
never,คำว่า never แปลเป็นปฏิเสธไปเลย คือ ไม่ ,,,
minor and serious,เบากับหนัก,,129,
minor king,"2025-04-26 minor king, petty ใช้ว่า อนุราชา / great king ใช้ว่า มหาราชา, มหากษัตริย์",,127,
Minor Light Heaven (See eighteen heavens),,Shōkō-ten （少光天）: ,,
Minor Purity Heaven (See eighteen heavens),,Shōjō-ten （少浄天）: ,,
minor world system (See major world system),สหัสสะโลกธาตุ,shō-sensekai （小千世界）: ,38,
Mirakutsu （弥羅掘）,,Mirakutsu （弥羅掘）,,
Miran,,Mīrān （ミーラーン）: ,,
"Mirror on the Meaning of the Middle and the Extreme, the",ปฤจฉาความหมายของสายกลางและสุดโต่ง,,30,
Misawa Kojirō （三沢小次郎）,,Misawa Kojirō （三沢小次郎）,,
Miscellaneous Āgama Sutra,สังยุตตนิกาย,Zō-agon-gyō （雑阿含経）: ,"30, 83",
miscellaneous thoughts,ความคิดฟุ้งซ่าน,,13,
Miscellaneous Treasury Sutra ,รัตนสูตร หรือ รัตนปริตร,,258,
misdeeds,กระทำชั่ว,,8,
misery,ทุกข์ลำเค็ญ,,8,
misfortune,เคราะห์ร้าย,,38,
Mishima Shrine,ศาลเจ้ามิชิมะ,,13,
misled ,สับสน หลงเข้าใจผิด,,7,
mist ,ไอ / หมอก,,19,
mistaken doctrines,คำสอนที่ผิด,,17,
mitra,,chishiki （知識）: ,,
Mitrayashas (See Shrīmālā),,Yūshō-ō （友称王）: ,,
mizunoto-i,มิสุโนะโตะ-อิ,,63,
mizunoto-tori,มิสุโนะโตะ-โตะริ,,43,
Mo Hsi,โมสี่,Bakki（妺嬉）,,
"Mo Hsi of the Hsia dynasty, Ta Chi of the Yin dynasty, and Pao Ssu of the Chou dynasty.",โม่สี่แห่งราชวงศ์เซี่ย ต้าจีแห่งราชวงศ์ยิน และเปาซี่แห่งราชวงศ์โจว,,"14,30",
Mo-ho-yen (See Tibetan Buddhism),,Makaen （摩訶衍）: ,,
Mo-kao Caves,,Bakkō-kutsu （莫高窟）: ,,
Mo-yeh,,Bakuya（莫耶）,,
Moggaliputta Tissa (See Buddhist Councils),,Mokkenrenshi-teishu （目犍連子帝須）: ,,
mole cricket,แมงกระชอน,,6,
molify,ผ่อนคลาย,,2,
moment of leisure,ยามว่าง,,9,
monarch,"กษัตริย์,ราชา",,"2,17",
monastic life,ชีวิตในเพศบรรพชิต,,"13, 61",
"Monastic Rules on Various Matters, The",สิกขาบทสูตร,,30,
Mongaku （文覚）,มงงะขุ,Mongaku （文覚）,,
Mongol empire,จักรวรรดิมองโกล,,65,
monk,"ภิกษุ, นักบวช, สมณะแปลว่าผู้สงบกิเลส",,2,
Monk Kaundinya,ภิกษุโกณฑัญญะ,,,
Monk Parshva ,พระปารศวะ,kaimoku-sho page 272,30,
monk Realization of Virtue,"พระภิกษุญาณสัมฤทธิ์  รอแก้ไขเป็นภิกษุญาณสัมฤทธิ์ 2021-01-30 เอาคำว่า ""พระ"" ออก",,"2,13,24",
monk Shore of Suffering,ภิกษุฟากทุกข์,Kugan biku,"10, 15",
monk Superior Intent ,ภิกษุอกรามติ,,7,
Mononobe no Moriya,โมโนโนเบะ โนะ โมริยะ,,"10, 67, 257",
Moon of Deliverance,พระวิมุตติจันทราโพธิสัตว์,,30,
Moon of Deliverance,พระวิมุตติจันทราโพธิสัตว์,Gedatsugatsu-bosatsu （解脱月菩薩）: ,30,
Moon of Deliverance,,Gedatsugatsu（解脱月菩薩）,,
Moon Storehouse,พระจันทรครรภ์โพธิสัตว์,Gatsuzō（月蔵菩薩）,66,
"Shen Nung, Huang Ti, Hua T’o, and Pien Ch’üeh ",ท่านเสินหนง ท่านหวงตี้ ฮัวโต๋ และท่านเปี่ยนเชวี่ย,,76,
Moon Storehouse (See age of quarrels and disputes),,Gatsuzō-bosatsu （月蔵菩薩）: ,,
moon-loving meditation,จันทรเปรมสมาธิ,gatsuai-zammai （月愛三昧）: ,76,
The Sutra of the Conversion of Barbarians by Lao Tzu ,คัมภีร์ว่าด้วยการเปลี่ยนแปลงอนารยชน โดยเล่าจื่อ ,,66,
"moon, god of the",,Gatten （月天）: ,,
moonflower,ต้นดอกชมจันทร์,,29,
Moonlight,จันทรประภาโพธิสัตว์,Gakkō-bosatsu （月光菩薩）: ,,
Moonlight,พระจันทรประภา,Gakkō（月光王）,83,
Moonlight,,Gakkō（月光菩薩）,,
mooring rope,เชือกผูกเรือ,,3,
more generally,ความหมายโดยรวม,,15,
more specifically,ความหมายเฉพาะ,,15,
Moriya,ท่านโมริยะ,,10,
mortal flesh,กายเนื้อ,,101,
mortal senses,มังสจักษุ,,52,
most fervent wish,ความปรารถนาอันแรงกล้า,,24,
most honored of heavenly and human beings (Seeheavenly being among heavenly beings),,tennin-son （天人尊）: ,,
most honored of two-legged beings,,nisoku-son （二足尊）: ,,
most honored of two-legged beings,,ryōsoku-son （両足尊）: ,,
most influenced figure,มีอำนาจสูงสุด,,,
Mother of Demon Children,นางยักษ์หาริตี,Kishimojin （鬼子母神）: ,,
Mother of Demon Children,นางยักษ์หาริตี,Kishimojin（鬼子母神）,,
Mother of Demon Children Sutra (See Mother of Demon Children),,Kishimo-kyō （鬼子母経）: ,,
Mother of Devil Children,นางยักษ์หาริตี,,,
Mount Ch’ing-liang ,เขาชิงเหลียง,,7,
Mount Ch’u,ภูเขาฉู่,,8,
Mount Chakravada,จักรวาลคีรี,,12,
Mount Clear and Cool,ภูเขาสีตบรรพต,,"38, 48 ",
Mount Fragrant,คันธมาทน์คีรี ,,12,
Mount Gridhrakūta ,เขาคิชฌกูฏ,,12,
Mount Hiei,เขาฮิเออิ,,2,
Mount Hua ,เขาหัวซาน,,32,
Mount Khadira,ไวธรีคีรี,,12,
Mount Kharadīya,ภูเขากรวิก,,38,
Mount Kiyosumi ,เขาคิโยซูมิ,,17,
Mount Kukkutapada,เขากุกกุฎสัมปาตบรรพต,,"2, 30, 38",
Mount Lu (See Hui-yüan),,Ro-zan （廬山）: ,,
Mount Minobu,เขามิโบนุ,,161,
Mount Nimindhara,เนมินธรคีรี,,12,
Mount Potalaka,ภูเขาโปตลก (โปตะละกะ),Fudaraku-sen （補陀落山）: ,"38,55,68",
Mount Shou-yang,ภูเขาโซวหยาง,,61,
Mount Sumeru,เขาพระสุเมรุ,,,
Mount Sumeru,สุเมรุคีรี,,12,
Mount Ta-su (See Nan-yüeh),,Daiso-zan （大蘇山）: ,,
Mount Toribe,ภูเขาโทริเบะ,,13,
Mount Wu-t’ai ,ภูเขาอู่ไถ,,48,
Mount Yugamdhara,ยุคันธรคีรี,,12,
mountain god fire,ไฟเทพเจ้าภูเขา,,2,
mountain island of P’eng-lai,เกาะภูเขาฝงไหล,,"7,10",
Mountain King,ราชาภูเขา,Sannō （山王）: ,,
"mountain of death, the",ภูเขาแห่งความตาย,,52,
Mountain of Immortals and Sages,เทพฤาณีคีรี,,12,
Mountain of Past Wisdom,เกตุมดีคีรี,,12,
Mountain school (1),,Sammon-ha （山門派）: ,,
Mountain school (2),,Sange-ha （山家派）: ,,
Mountain Sea Wisdom Unrestricted Power King,สาครวรธรพุทธวิกรีฑิตาภิชญตถาคต,Sengaie-jizaitsūō-nyorai （山海慧自在通王如来）: ,13,
mountain temple,วัดบนภูเขา,,38,
mountain worship (See Shugendō school),,sangaku-shinkō （山岳信仰）: ,,
moved,ตื้นตัน,,21,
moxibustion traeatment,วิธีเผาไฟรมยา,,"30, 82",
mud pie,ขนมดินปั้น,,"113,127",
muddied,ขุ่นมัว,,8,
muddy water,น้ำขุ่น,,"19,34",
mudra,มุทรา(ท่าทาง),ingei （印契）: ,11,
mudras and mantras,มุทรา(ท่าทาง)และมนตรา(ท่องมนต์),kaimoku-sho part1,11,
Mugaku Sogen （無学祖元）,,Mugaku Sogen （無学祖元）,,
"mugwort, hemp","ต้นแขม,ป่าน", ,2,
multitude ,จำนวนมากมาย,,6,
Multitudinous Graceful Actions Sutra,,Fuyō-kyō （普曜経）: ,,
mundane affairs,กิจวัตรประจำวัน,,6,
Munetsuna ,มุเนะจึนะ,,,
muni,,muni （牟尼）: ,,
muni,,shōnin （聖人）: ,,
Murasaki Shikibu,มุราซากิ ชิคิบุ,,,
Murdhagata,มูรธาคต,,48,
Musashi-bo Ennichi,มูซาชิ โบ เอ็นนิจิ,,257,
musical recitation of sutras (See Ryōnin),,shōmyō （声明）: ,,
mustard seed,เมล็ดผักกาด,,13,
mustard seed,เมล็ดฝิ่น,,2,
mustard-seed kalpa,,keshi-kō （芥子劫）: ,,
Mutsu,เมืองมุจึ,,32,
Mutsura ,มุจึระ,,13,
Mutsura barrier,ด่านมุจึระ,,13,
mutual identification and nonduality,ความเป็นเอกภาพเดียวกันกับอทวิภาวะ,kon do mu ni,"10,30",
mutual possession of the Ten Worlds,,jikkai-gogu （十界互具）: ,,
mutually inclusive relationship,มีพร้อมซึ่งกันและกันอย่างครบถ้วนสมบูรณ์,,1,
my own rejoicing,ความปลื้มปีติ,,9,
myō （妙）,,myō （妙）,,
Myōe （明恵）,,Myōe （明恵）,,
Myoho-renge-kyo （妙法蓮華経）,,Myoho-renge-kyo （妙法蓮華経）,,
"Myōhō, the lay nun",อุบาสิกาเมียวอิจิ,Myōhō-ama （妙法尼）: ,,
Myōichi-nyo （妙一女）,,Myōichi-nyo （妙一女）,,
"Myōichi, the lay nun",,Myōichi-ama （妙一尼）: ,,
Myōjō Pond,,Myōjō-ga-ike （明星が池）: ,,
Myōmitsu （妙密）,"เมียวมิจึโชนิน 妙密上人
นิชิเมียวโชนิน  日妙聖人 
คนละตัวครับ  上人 ผู้สูงส่ง 聖人 อริยบุคคล",Myōmitsu （妙密）,,
Myōren （妙蓮）,,Myōren （妙蓮）,,
"Myōshin, the lay nun",,Myōshin-ama （妙心尼）: ,,
Myoun,พระเมียวอุน,,105,
Myōun （明雲）,,Myōun （明雲）,,
mysterious nature of our life,ธรรมชาติที่น่าอัศจรรย์ของชีวิต,,1,
Mysterious Spells of the Eleven-faced Perceiver of the World’s Sounds Sutra (See Eleven-faced Perceiver of the World’s Sounds),,Jūichimen-kannon-jinju-kyō （十一面観音神呪経）: ,,
mystery of the body (See three mysteries),,shin-mitsu （身密）: ,,
mystery of the mind (See three mysteries),,i-mitsu （意密）: ,,
mystery of the mouth (See three mysteries),,ku-mitsu （口密）: ,,
mystic entity of the Middle Way,ตัวตนมหัศจรรย์แห่งความเป็นจริงเพียงหนึ่งเดียวของทางสายกลาง,,1,
mystic formulas (ธารณี),ธารณี / มนตร์,kaimoku-sho page 267,30,
Mystic Law,ธรรมมหัศจรรย์,myōhō （妙法）: ,,
mystic principle of merit and benefit (Seeten mystic principles),,kudoku-riyaku-myō （功徳利益妙）: ,,
mystic principle of practice (See ten mystic principles),,gyō-myō （行妙）: ,,
mystic principle of preaching (See ten mystic principles),,seppō-myō （説法妙）: ,,
mystic principle of reality (See ten mystic principles),,kyō-myō （境妙）: ,,
mystic principle of relationship (See ten mystic principles),,kenzoku-myō （眷属妙）: ,,
mystic principle of responsive communion (See ten mystic principles),,kannō-myō （感応妙）: ,,
mystic principle of stages (See ten mystic principles),,i-myō （位妙）: ,,
mystic principle of the three elements (See ten mystic principles),,sanhō-myō （三法妙）: ,,
mystic principle of transcendental power (See ten mystic principles),,jintsū-myō （神通妙）: ,,
mystic principle of true benefit (See ten mystic principles),,honriyaku-myō （本利益妙）: ,,
mystic principle of true life span (See ten mystic principles),,honjumyō-myō （本寿命妙）: ,,
mystic principle of true nirvana (See ten mystic principles),,honnehan-myō （本涅槃妙）: ,,
mystic principle of true preaching (See ten mystic principles),,honseppō-myō （本説法妙）: ,,
mystic principle of true relationship (See ten mystic principles),,honkenzoku-myō （本眷属妙）: ,,
mystic principle of true responsive communion (See ten mystic principles),,honkannō-myō （本感応妙）: ,,
mystic principle of true transcendental power (Seeten mystic principles),,honjintsū-myō （本神通妙）: ,,
mystic principle of wisdom (See ten mystic principles),,chi-myō （智妙）: ,,
mystic reality,ความจริงมหัศจรรย์,,"4,11",
mystic rituals,พิธีกรรมลี้ลับ,,introduction,
mystic truth,สัจธรรมมหัศจรรย์,,1,
mystic wisdom,ปัญญามหัศจรรย์,,4,
mythology ,เทพปกรณัม,,"13, 30",
Nadī Kāshyapa,,Nadai-kashō （那提迦葉）: ,,
Nāgabodhi,,Ryūchi （竜智）: ,,
Nāgabodhi,,Ryūchi（竜智）,,
Nāgārjuna,พระนาคารชุน,Ryūju （竜樹）: ,,
Nāgārjuna,พระนาคารชุน,Ryūju（竜樹）,,
Nagarjuna’s Treatise on the Middle Way,บทนิพนธ์เรื่องมาธยมิกศาสตร์ของพระนาคารชุน,,46,
Nagasa District,ตำบลนางาสะ,,25,
Nāgasena,,Nasen-biku （那先比丘）: ,,
"Nagoe, the lay nun of",นาโงเอะ (ชื่ออุบาสิกา),Nagoe-no-ama （名越の尼）: ,"4, 25, 59",
Nahusha,พระนาหุชา,Nagosa-ō（那睺沙王）,83,
Nairanjanā River,,Nirenzen-ga （尼連禅河）: ,,
naishi,ไนชิ,,17,
naishidokoro,ไนชิโดโคโระ,,17,
"Nakaoki, the lay priest of",,Nakaoki-nyūdō （中興入道）: ,,
Nakatomi no Kamako = Fujiwara no Kamatari,อำมาตย์นากาโทมิ โนะ คามาโกะ = อัครมหาเสนาบดีฟูจิวาระ โนะ คามาทาริ,,257,
Nālandā Monastery,วัดนาลันทา,Naranda-ji （那爛陀寺）: ,30,
Nam-myoho-renge-kyo （南無妙法蓮華経）,,Nam-myoho-renge-kyo （南無妙法蓮華経）,,
"Nam-myoho-renge-kyo, which is implicit in the depths of the “Life Span” chapter.",คือนัมเมียวโฮเร็งเงเคียว ซึ่งเป็นความหมายใต้ตัวอักษรในส่วนลึกของ “บทการหยั่งอายุกาลฯ”. ,,18,
Nambu Rokurō Sanenaga （南部六郎実長）,,Nambu Rokurō Sanenaga （南部六郎実長）,,
"name, essence, quality, function, and teaching (See five major principles)",ชื่อ ตัวตน คุณสมบัติ การทำงาน และคำสอน (ดูหลักสำคัญ 5 ประการ),myō-tai-shū-yū-kyō （名体宗用教）: ,13,
namu （南無）,,namu （南無）,,
Namu Amida Butsu （南無阿弥陀仏）,,Namu Amida Butsu （南無阿弥陀仏）,,
Namu-Amida-butsu,นามุอะมิดะบุตจึ / เขียนแบบไม่มี - คั่น,,17,
Namu-ichijō-myōten,นามุอิชิโจเมียวเท็น,,9,
Nan Utpalavarna,อุบาสิกาอุบลวรรณา,kaimoku-sho part1,,
Nan-shan branch of the Precepts school (See Tao-hsüan),หนานซัน,Nanzan Risshū （南山律宗）: ,66,
Nan-yüeh,พระหนานเยี่ย,Nangaku （南岳）: ,"9, 39, 43",
Nan-yüeh,,Nangaku（南岳）,,
Nanda,พระสุนทรนันทะ,Nanda （難陀）: ,,
Nanda,,Nanda（難陀）,,
Nanda (See eight great dragon kings),,Nanda-ryūō （難陀竜王）: ,,
Naniwa,ชาวนะนิวะ,,13,
Nanjō Hyōe Shichirō （南条兵衛七郎）,,Nanjō Hyōe Shichirō （南条兵衛七郎）,,
Nanjō Shichirō,ท่านนันโจ ชิจิโร,,"10, 81",
Nanjō Shichirō Gorō （南条七郎五郎）,,Nanjō Shichirō Gorō （南条七郎五郎）,,
Nanjo Tokimitsu,ท่านนันโจ โทขิมิตจึ,,161,
Nanjō Tokimitsu （南条時光）,ท่่านนันโจ โทขิมิจึ,Nanjō Tokimitsu （南条時光）,10 12,
Nara,เมืองนาระ,,2,
naraka,,naraku （奈落）: ,,
Nārāyana,,Naraen （那羅延）: ,,
Nārāyana,,Naraen-ten（那羅延天）,,
Narendrayashas,,Narendaiyasha （那連提耶舎）: ,,
narrowly escaped ,หนีรอดไปได้อย่างหวุดหวิด,,4,
nature,สันดาน,,11,
nature ,ธาตุแท้/ลักษณะพื้นฐานชีวิต,,"6,14",
nature and degree of one’s offense,ลักษณะและระดับของบาป,,61,
nature of beings,สวลักษณะ,,30,
nature of life,ธรรมชาติของชีวิต,,1,
natures ,ธรรมชาติ,,8,
nayuta,นยุตะ (หน่วยวัดปริมาณของอินเดีย ซึ่งในอภิธรรมโกษศาสตร์ได้ระบุว่า 1 นยุตะเท่ากับ แสนล้าน ในขณะที่จากแหล่งข้อมูลทั่วไประบุว่าเท่ากับ 10 ล้าน),[那由多] (Skt; Jpn nayuta ),137,
nayuta,,nayuta （那由多）: ,,
nayutas of kalpas,นยุตะกัป,,8,
near-perfect enlightenment,วิปัสสนสัมมาสัมโพธิญาณ,tōgaku （等覚）: ,13,
negative effects,ผลกรรมชั่ว,,introduction,
negligent,เหลาะแหละ,,116,
neither uphold the precepts nor break them,ไม่ยึดถือศีลไม่ละเมิดศีล,,8,
Nembutsu,สุขาวดี,Nembutsu （念仏宗）,,
Nembutsu （念仏）,,Nembutsu （念仏）,,
"Nembutsu Chosen above All, The",,Senchaku-shū （選択集）: ,,
"Nembutsu Chosen above All,The","หนังสือ""การเลือกสุขาวดีเหนือคำสอนอื่นใด""",เซนชะขุชู,2 / 13,
Nembutsu priests,สงฆ์ของนิกายสุขาวดี,,32,
Nembutsu school,นิกายสุขาวดี,Nembutsu-shū （念仏宗）: ,38,
Nembutsu teachings,คำสอนของนิกายสุขาวดี,,"7,13",
Nen’a （然阿）,พระเน็นอะ ,Nen’a （然阿）,30,
Nen’a Ryochu ,พระเน็นอะ เรียวชู ,,,
Never Disparaging,,Fukyō（不軽菩薩）,,
Never Disparaging,,Fukyō-bosatsu （不軽菩薩）: ,,
Never Disparaging,,Jōfukyō-bosatsu （常不軽菩薩）: ,,
Never Disparaging Bodhisattva,พระสทาปริภูตโพธิสัตว์,,24,
Never Disparaging chapter,,Fukyō-bon （不軽品）: ,,
never-perishing consciousness (See ālaya-consciousness),,mubotsu-shiki （無没識）: ,,
New Doctrine school (See True Word school),นิกายคำสอนใหม่ (นิกายชินงิ),Shingi-ha （新義派・新義真言宗）: ,66,
new translations,,shin’yaku （新訳）: ,,
Nichiben （日弁）,,Nichiben （日弁）,,
Nichidai （日代）,,Nichidai （日代）,,
Nichigen-nyo （日眼女）,คุณนายนิชิเง็นเนียว,Nichigen-nyo （日眼女）,258,
Nichigō （日郷）,,Nichigō （日郷）,,
Nichiji （日持）,,Nichiji （日持）,,
Nichijū （日什）,,Nichijū （日什）,,
Nichijun （日順）,,Nichijun （日順）,,
Nichikan （日寛）,,Nichikan （日寛）,,
Nichikō （日講）,,Nichikō （日講）,,
Nichikō Hori,พระนิชิโค โฮริ,,introduction,
Nichimoku （日目）,,Nichimoku （日目）,,
Nichimyō （日妙）ท่านเมียวมิจึโชนิน (อริยบุคคล) ถูกต้องแล้ว ตามภาษาญี่ปุ่น,"เมียวมิจึโชนิน 妙密上人
นิชิเมียวโชนิน  日妙聖人
คนละตัวครับ  上人 ผู้สูงส่ง 聖人 อริยบุคคล",Nichimyō （日妙）,36,
Nichinyo （日女）,,Nichinyo （日女）,,
Nichiō （日奥）,,Nichiō （日奥）,,
Nichiren （日蓮）,นิชิเร็น (ในกรณีพระนิชิเร็นพูดถึงตัวเองเป็นบุคคลที่สาม),Nichiren （日蓮）,,
Nichiren school,,Nichiren-shū （日蓮宗）: ,,
Nichiren Shōshū （日蓮正宗）,,Nichiren Shōshū （日蓮正宗）,,
Nichirō （日朗）,,Nichirō （日朗）,,
Nichiu （日有）,,Nichiu （日有）,,
Nichizen （日禅）,,Nichizen （日禅）,,
Nigantha Nātaputta,,Nikenda-nyakudaishi （尼乾陀若提子）: ,,
Niiama （新尼）,นิอิอามะ ,Niiama （新尼）,,
Niida Shirō Nobutsuna （新田四郎信綱）,,Niida Shirō Nobutsuna （新田四郎信綱）,,
Niiho ,นิอิโฮะ,,49,
Niike Saemon-no-jō （新池左衛門尉）,,Niike Saemon-no-jō （新池左衛門尉）,,
nikāya (See Āgama sutras),,nikāya （ニカーヤ）: ,,
Nikke （日華）,,Nikke （日華）,,
Nikkō （日興）,,Nikkō （日興）,,
Nikō （日向）,พระนิโค,Nikō （日向）,71,
Nikō’s Records,,Nikō-ki （日向記）: ,,
Nimimdhara (See four seas),,Nimindara-sen （尼民達羅山）: ,,
nine consciousnesses,9 วิญญาณ,ku-shiki （九識）: ,,
nine divisions of the scriptures,,kubun-kyō （九分経）: ,,
nine divisions of the teachings,,kubun-kyō （九分教）: ,,
nine great ordeals,บรรดามหาภัย 9 ประการ,kuō-no-dainan （九横の大難）: ,"30, 49",
nine honored ones on the eight-petaled lotus,พระพุทธะกับโพธิสัตว์ 9 องค์บนดอกบัว 8 กลีบ,hachiyō-kuson （八葉九尊）: ,30,
nine mountains and eight seas,,kusen-hakkai （九山八海）: ,75,
Nine realms of existence,9 โลก,,,
