Vocab,ไทย,Japanese,gosho number,
The beginning of the Latter Day of the Law will not be without inconspicuous benefit,ในตอนต้นของสมัยธรรมปลายจะไม่ขาดบุญกุศลที่ไม่ปรากฏชัด,,"39, 57",
the beginningless past,สมัยอนาทิกาล,,33,
the being and the environment,ตัวตนกับสิ่งแวดล้อม,,40,
Mount Hui-chi in Wu,ภูเขาฮุ่ยจื๋อ ในรัฐอู๋,,76,
the benefit of fiftieth hearer,บุญกุศลจากการถ่ายทอดที่เปลี่ยนไปของคนที่ 50,,10,
people of Lu,ประชาชนชาวหลี,,66,
Mount Hui-chi in Wu,ภูเขาฮุ่ยจื๋อในรัฐอู๋,,76,
The Biography of Bodhisattva Āryadeva (SeeĀryadeva),,Daiba-bosatsu-den （提婆菩薩伝）: ,,
The Biography of Bodhisattva Nāgārjuna(See Nāgārjuna),,Ryūju-bosatsu-den （竜樹菩薩伝）: ,,
The Biography of the Dharma Teacher Vasubandhu (See Asanga),,Basubanzu-hosshi-den （婆藪槃豆法師伝）: ,,
The Biography of the Great Teacher T’ien-t’ai Chih-che of the Sui Dynasty (See Chang-an),ชีวประวัติของพระมหาธรรมาจารย์เทียนไท้ผู้ทรงปัญญาแห่งราชวงศ์สุย,Zui-tendai-chisha-daishi-betsuden （隋天台智者大師別伝）: ,66,
Essay on the Five Teachings of the Flower Garland School,ปกิณกะเกี่ยวกับ 5 คำสอนของนิกายอวตังสก,,66,
"The Biography of the Tripitaka Master of Ta-tz’u-en-ssu Temple of the Great T’ang Dynasty(See Biography of the Tripitaka Master of Ta-tz’u-en-ssu Temple, The)",ชีวประวัติของพระตรีปิฎกาจารย์แห่งวัดต้าฉือเอินซื่อ,Daitō-daijionji-sanzō-hosshi-den （大唐大慈恩寺三蔵法師伝）: ,"30, 50",
"the bleary-eyed, the squint-eyed, the one-eyed",ตาที่พร่ามัว ตาเหล่ ตาข้างเดียว,,30,
"The blessings and wisdom of the objective and subjective worlds [that is, life and its environment] are immeasurable. Nam-myoho-renge-kyo has these two elements of blessings and wisdom	",ผลบุญและปัญญาของโลกแห่งความเป็นจริงและโลกแห่งจิตพิสัยนั้นไม่อาจวัดได้ นัมเมียวโฮเร็งเงเคียวมีพร้อมด้วยสองสิ่งแห่งผลบุญและปัญญา ,,,
"the Bodhisattva Nagarjuna's ""Commentary on the Ten Stages Sutra""",บทนิพนธ์วิภาษาศาสตร์ 10 ขั้นของโพธิสัตว์นาคารชุน,,2,
the boy Diamond Pounder,พิธีบูชาวัชรกุมาร,Kongō-dōji（金剛童子）,38,
the boy Good Treasures,สุธนกุมาร,Zenzai-dōji（善財童子）,"13, 68",
the boy Invincible,,Mushō-dōji（無勝童子）,,
the boy Life of Virtue and the girl Possessor of Virtue (德生童子及有德童),ศรีสัมภวะกุมารและศรีมติศจะกุมารี ,,33,
the boy Snow Mountains,หิมาลัยกุมาร ,Sessen-dōji（雪山童子）,,
the boy Virtue Victorious,,Tokushō-dōji（徳勝童子）,,
the Buddha Great Universal Wisdom Excellence,พระมหาภิชญาชญานาภิภูพุทธะ,,"10, 32, 61,89",
The Buddha Joy Increasing,พระอภิรติอารยพุทธะ,Kangi Zoyaku,13,
the Buddha Lion Sound King,พระสิงหนาทราชาพุทธะ,,7,
the Buddha of recent enlightenment,พระพุุทธะที่เพิ่งบรรลุพุทธภาวะ,,27,
the Buddha who attained enlightenment for the first time in his present lifetime (See attainment of Buddhahood in the remote past),,shijō-shōkaku-no-hotoke （始成正覚の仏）: ,,
"the Buddha, the Law, and the Buddhist Order (See three treasures)",พระพุทธ พระธรรม พระสงฆ์,buppōsō （仏法僧）: ,,
the Buddha’s statement,พระดำรัสของพระพุทธะ,,30,
"the Buddhas and bodhisattvas of the ten
directions",พระพุทธะและโพธิสัตว์ 10 ทิศ,,40,
"The Buddhas, the World-Honored Ones, appear in the world for one great reason alone",พระพุทธะ พระผู้มีพระภาคเจ้าทั้งหลาย อุบัติขึ้นในโลกด้วยเหตุผลอันยิ่งใหญ่เพียงหนึ่งเดียว.,,30,
the Buddhist life,ชีวิตทางธรรม,,"13, 61",
the Buddhist teachers of China vied with one another to steal the ghee,อาอาจารย์ทางพุทธศาสนาของประเทศจีนต่างแย่งกันขโมยน้ำมันเนย,,"30, 38",
the carriage that takes us at once to the place of enlightenment,เป็นพาหนะที่พาเราไปสู่สถานที่แห่งการบรรลุพุทธภาวะทันที,,8,
the ceremony of the wheel-turning king,พิธีบูชาราชสูยะ,,38,
the ceremony of Wish-granting Wheel,พิธีีจินตามณีจักร,,38,
the Ch'an,นิกายฌาน,,,
The Chenyuan Era Catalog of the Buddhist Canon,บันทึกรายชื่อคัมภีร์พุทธศาสนาในสมัยเจ็งง้วง (แต้จิ๋ว) เจินหยวน (จีนกลาง),,2,
the civil and the military,พลเรือนและทหาร,,13,
The Classic of Filial Piety,คัมภีร์กตัญญู,,"7, 61",
The Collected Works of the Universally Illuminating Soul-Inspiring One (See Shinzei),,Henjō-hokki-shōryō-shū （遍照発揮性霊集）: ,,
the collection of tales from the non-Buddhist classics,หนังสือรวบรวมตำนานเรื่องเล่านอกพุทธศาสนา,,32,
the common teaching on wisdom,คำสอนหมวดปรัชญาปารมิตา,,11,
the complete collection of the scriptures ,หนังสือรวบรวมคัมภีร์ฉบับสมบูรณ์,,28,
The Complete Works of Nichiren Daishonin,ธรรมนิพนธ์ของพระนิชิเร็นไดโชนินฉบับสมบูรณ์,,"preface, 49",
The Comprehensive Catalog of Sutras(See Tao-an),,Sōrishukyō-mokuroku （綜理衆経目録）: ,,
the comprehensive practice,การปฏิบัติกว้าง,,14,
the concept of the ocean-imprint meditation,แนวคิดเรื่องสาครมุทราสมาธิ,,30,
the conditioned,สังขตธรรม/มีเหตุปัจจัยปรุงแต่ง,,8,
the connecting teaching,คำสอนสัมพันธ์,,"11, 13",
the constable of Sado,ผู้ตรวจการเกาะซาโดะ,,49,
the course of bodhisattva practice,เส้นทางการบำเพ็ญเพียรโพธิสัตว์,,47,
the court ministers pay to the ruler of the empire,เหล่าเสนาบดีเคารพผู้ครองอาณาจักร,,30,
the Dazaifu office,ศูนย์การปกครองดะไซฝุ,,82,
"The Deflection of Disputes (Skt: Vigraha-vyavartani)
",วิครหวยาวรตนี,,,
"the deities of sun and moon, the
morning star, the seven stars in the Big Dipper in the northern sky, the  twenty-
eight constellations ,","มีอยู่ในชีวิตของสุริยเทพ จันทรเทพ ดาวประกายพรึก ดาวทั้ง 7
ในกลุ่มดาวอุตราษาฒทางทิศเหนือ นักษัตร 28 หมู่",,13,
the determinate groups,กลุ่มกุศลพีชะ  ,,47,
the Dharma Teacher Fa-tsang,พระธรรมาจารย์ฝ่าจ้าง,,37,
the dictates of filial piety,หลักคำสอนเรื่องความกตัญญูต่อบุพการี,,30,
the difiled Latter Day of the Law,สมัยธรรมปลายที่มีมลทิน,,47,
the Discipline Master Keishin,พระธรรมวินัยเคอิชิน,,49,
the discourse on emancipation from the world of desire,บทนิพนธ์ว่าด้วยการหลุดพ้นจากกามภพ,,11,
The Doctrine of Attaining Buddhahood in One's Present Form,ธรรมนิพนธ์เรื่องปรัชญาธรรมแห่งการบรรลุพุทธภาวะในกายนี้,,65,
The Doctrine of Attaining Buddhahood in One’s Present Form,ปรัชญาธรรมแห่งการบรรลุพุทธภาวะในกายนี้,,,
the doctrine of five natures,หลักธรรมเรื่องปัญจโคตร,,37,
The doctrine of the immediate attainment of enlightenment,ปรัชญาธรรมแห่งการบรรลุพุทธภาวะในทันที,ton sho bo dai,8,
the doctrine of three thousand realms in a single moment of life,ปรัชญาธรรมแห่งหนึ่งขณะจิตสามพัน,,30,
the doctrine that both the mind and objective reality are real,ปรัชญาที่ว่าทั้งจิตใจและความเป็นจริงเชิงวัตถุวิสัยเป็นจริง,,16,
the doctrine that both the mind and objective reality are without substance,ปรัชญาที่ว่าทั้งจิตใจและความเป็นจริงเชิงวัตถุวิสัยไม่มีแก่นสาร,,16,
the doctrine that the mind alone is real,ปรัชญาที่ว่าจิตใจเท่านั้นเป็นจริง,,16,
"the doctrines of the ten stages of security, the ten stages of practice, the ten stages of devotion, the ten stages of development",หลักธรรมเรื่อง 10 ขั้นของความมั่นคง 10 ขั้นของการปฏิบัติ 10 ขั้นของการอุทิศ  10 ขั้นของการพัฒนา,,30,
the dragon king,สาครนาคราช,,101,
the dragon king's daughter  / dragon girl,นาคราชบุตรี,,"82, 123",
the dust particles of a thousand worlds,"ผงธุลีของ 1,000 โลกธาตุ",,"39, 44",
the earlier Buddhas,พระพุทธะก่อนหน้า,,27,
the earlier Buddhas,เหล่าพระพุทธะก่อนหน้า,,27,
the eight groups,คติ 8,,101,
"the eighteenth year of the K’ai-yüan era (c.e. 730), cyclical sign kanoe-uma",ปีที่ 18 ของยุคไคหยวน (ค.ศ. 730) ปีจักรราศี คะโนะเอะ-อุมะ ,,7,
"the eighth year of Bun’ei (1271), cyclical sign kanoto-hitsuji",ปีบุนเอที่ 8 (ค.ศ. 1271) ปีจักรราศีคาโนโตะ-ฮิจึจิ,,26,
"the eighth year of Bun’ei (1271), cyclical sign kanoto-hitsuji",ปีบุนเอที่ 8 (ค.ศ.1271) ปีจักรราศีคาโนะโตะ-ฮิจึจิ,,24,
the eighty thousand Buddhist teachings,"คำสอนพุทธศาสนา 80,000 ธรรมขันธ์",,14,
the emanation Buddhas of the ten directions,พระพุทธะกายแยก 10 ทิศ,,52,
the emanations of the World-Honored One,พระพุทธะแบ่งภาค,,39,
the emancipation of the perfect,นิรมาณกายของคำสอนสมบูรณ์,,47,
the emperor and his subjects,จักรพรรดิกับข้าแผ่นดิน,,32,
the entire realm of phenomena,ธรรมธาตุ,Hokai,1,
the entire realm of phenomena,โลกของปรากฏการณ์ทั้งหมด,,40,
the error-bound teachers of the provisional teachings,อาจารย์ชั่วร้ายแห่งคำสอนชั่วคราว,,8,
the essentail nature of phenomena and the true aspect of reality ,ธรรมชาติแท้จริงของปรากฏการณ์ทั้งหลายและลักษณะที่แท้จริงของความเป็นจริง (ธรรมธาตุอันเป็นความจริงแท้สูงสุดที่ไม่เปลี่ยนแปลง),,"1,7,13,47",
The Essential Doctrines Transmitted within the Tendai Lotus School ,คาถาธรรมของการสืบทอดในนิกายเท็นไดปุณฑริก,,29,
"The Essential Meaning of “Praising the Profundity of the Lotus Sutra""",ความหมายอันเป็นสาระสำคัญของ “การยกย่องความลึกซึ้งของสัทธรรมปุณฑริกสูตร”,,30,
the essential practice,การปฏิบัติที่เป็นสาระสำคัญ,,14,
The Essentials of Government in the Chen-kuan Era,หนังสือสาระสำคัญเกี่ยวกับการปกครองสมัยเจินกวน,,32,
The Essentials of Government in the Chen-kuan Era,,,32,
The Essentials of Rebirth in the Pure Land,ปกรณ์วิเศษเรื่องการเกิดใหม่ในดินแดนสุขาวดี,Ōjō-yōshū （往生要集）: ,13,
The Essentials of the Mahāvairochana Sutra,ปกรณ์วิเศษของมหาไวโรจนสูตร,,13,
the eternally inherent Buddha nature,ธรรมชาติพุทธะที่มีอยู่แต่ดั้งเดิมชั่วนิรันดร์,,"27, 44",
the exiles and sentences of death imposed on you ,,,30,
the expanded replacement of the three vehicles with the one vehicle,การแทนที่ตรียานด้วยเอกยานแบบกว้าง,,38,
the eyes of ordinary people,มังสจักษุ,,4,
the eyes of the Buddha,พุทธจักษุ,,4,
"the fifth year of Bun’ei, cyclical sign tsuchinoe-tatsu",ปีบุนเอที่ 5 (ค.ศ. 1268) ปีจักรราศีจึชิโนะเอะ-ทะจึ,,2 (postscript),
the final analysis,สรุปแล้ว,,"11,13",
the final and ultimate statement,ถ้อยแถลงสรุปสุดท้ายและสูงสุด,,8,
the finest and most subtle flavor ,ส่วนที่มีรสชาติดีที่สุดและละมุนที่สุด,,30,
the fire at the end of the kalpa of decline,ไฟประลัยกัลป์,,30,
The first volume of On “Great Concentration and Insight”,ม้วนที่ 1 ของอรรถาธิบายมหาสมถวิปัสสนา,,101,
"the first year of Bun’ei (1264), cyclical sign kinoe-ne",ปีบุนเอที่ 1 (ค.ศ.1264) ปีจักรราศี คิโนะเอะ-เนะ,,9,
"the first year of Bunnō era (1260), with the cyclical sign kanoe-saru",ปีบุนโอที่ 1 (ค.ศ. 1260) ปีจักรราศีคาโนะเอะ-ซารุ,,2 (postscript),
"the first year of Kenji [1275], cyclical sign kinoto-i",ปีเคนจิที่ 1 (ค.ศ. 1275) ปีจักรราศีคิโนะโตะ อิ,,"59, 258",
"the first year of Kōan (1278), cyclical sign tsuchinoe-tora",ปีโคอันที่ 1 (ค.ศ. 1278) ปีจักรราศี จึชิโนะเอะ-โทระ,,128,
"the first year of Shōka era, cyclical sign hinoto-mi",ปีโชกะที่ 1 (ค.ศ. 1257) ปีจักรราศีฮิโนะโตะ-มิ,,"2 (postscript),16 ",
"the first year of the Bun’ei era (1264), cyclical sign kinoe-ne",ปีบุนเอที่ 1 (ค.ศ. 1264) ปีจักรราศีคิโนะเอะ-เนะ ,,2 (postscript),
the five ascetics,ปัญจวัคคีย์,,27,
the five categories of Buddhas all employ a similar process (See five categories of Buddhas),,gobutsu-dōdō （五仏道同）: ,,
the five guides for propagation,หลักการเผยแผ่ธรรม 5 ประการ,,8,
"the five hundred and seven hundred voice-hearers will become Thus Come Ones Universal Brightness, the two thousand who have more to learn or do not have more to learn will become Thus Come Ones Jewel Sign, the nuns Mahāprajāpatī and Yashodharā will become Thus Come Ones Gladly Seen by All Living Beings and Endowed with a Thousand Ten Thousand Glowing Marks, respectively","สาวก 500 รูปกับ 700 รูปจะได้เป็นพระสมันตประภาสตถาคต  พระเสขะกับพระอเสขะ 2,000 รูปจะได้เป็นพระรัตนเกตุราชตถาคต  ภิกษุณีมหาประชาบดีจะได้เป็นพระสรรพสัตว์ปรียทรรศนะตถาคต และภิกษุณียโสธราจะได้เป็นพระรัศมีศตสหัสรปริปูรณธวัชตถาคต",,30,
the five men,ปัญจวัคคีย์,,250,
the five planets,ดาวเคราะห์ทั้ง 5 - ดาวพฤหัสบดี ดาวอังคาร ดาวศุกร์ ดาวพุธ และดาวเสาร์.,,2,
the five principles for propagation,หลักการเผยแผ่ธรรม 5 ประการ,,7,
the five thousand arrogant people,"คนอวดดี 5,000 คน",,39,
"the five, the six, or the ten practices","การปฏิบัติ 5 ชนิด, 6 ชนิด หรือ 10 ชนิด",,13,
"The fivefold bodies of the Law refer to the fivefold merit that represents the true and pure nature of a Buddha: precept body, meditation body, wisdom body, emancipation body, and knowledge-of-emancipation body.  ",ธรรมขันธ์ 5 หมายถึงกุศล 5 (fivefold merit) ซึ่งแสดงถึงธรรมชาติที่แท้และบริสุทธิ์ของพระพุทธะได้แก่ ศีลขันธ์ สมาธิขันธ์ ปัญญาขันธ์ วิมุตติขันธ์ และวิมุตติญาณทัสสนขันธ์.,,30,
The Fivefold Rules of Discipline,มหิศาสกวินัย,,9,
the Flower Garland Sutra concept of the phenomenal world as created by the mind alone,แนวคิดของอวตังสกสูตรเรื่องโลกธรรมเกิดจากจิตใจเท่านั้น,,30,
the Flower Garland Sutra concept of the phenomenal world as created by the mind alone,แนวคิดของอวตังสกสูตรเรื่องโลกธรรมเกิดจากจิตใจเท่านั้น,,30,
the form of true reality,รูปของความจริงแท้,so (โซ),14,
The Former Teachings,คำสอนก่อนหน้า(42ปีแรก ก่อนเทศนาสัทธรรมปุณฑริกสูตร),,382,
The four Buddhas of the four directions depicted in the Golden Light Sutra are transformation bodies of Shakyamuni Buddha,พระพุทธะ 4 องค์แห่ง 4 ทิศที่มีกล่าวอยู่ในสุวรรณประภาสสูตรคือพระศากยมุนีพุทธะอวตาร,,30,
the four forms of birth,กำเนิด 4,,6/21,
the four heavenly kings,ท้าวจตุมหาราชิก,shidaiteno,10,
the four heavenly kings,ท้าวจตุโลกบาล,,5,
The Four Meditations,จตุธยาน,,27,
the four teachings,คำสอน 4 ชนิด,,27,
"the four types of teachings are the Tripitaka teaching, the connecting teaching, the specific teaching, and the perfect teaching",คำสอน 4 ชนิด ได้แก่ คำสอนปิฎก คำสอนสัมพันธ์ คำสอนแยกจำแนก และคำสอนสมบูรณ์,,13,
the fourth meditation heaven in the world of form,จตุตถฌานภูมิในรูปภพ,,8,
the fourth volume of Great Concentration and Insight,ม้วนที่ 4 ของมหาสมถวิปัสสนา,,101,
the function to manifest,มีการทำงานที่สำแดงออกมา,,39,
the future Constellation Kalpa,กัปแห่งหมู่ดาวในอนาคต,,127,
The Garland of Birth Stories (SeeShibi),ชาดกมาลา,Bosatsu-honjō-manron （菩薩本生鬘論）: ,36,
the General of the Right,แม่ทัพฝ่ายขวา,,105,
the god of the moon,จันทรเทพ,,"23, 116",
the god of the stars,เทพแห่งดวงดาว,,23,
the god of the sun,สุริยเทพ,,"23, 116",
the god Shakra,พระอินทร์บันดาล,,37,
the god Vishvakarman,พระวิษณุกรรม (พระวิศวกรรม พระวิสสุกรรม),,4,
the gods of the seven shrines of Sannō,บรรดาเทพประจำ 7 ศาลเจ้าแห่งซันโน,,16,
the golden words,วจีทองคำ,,"9, 258",
The Great Canon of Monastic Rules ,มหาสังฆิกะวินัย,,18,
The Great Cloud Sutra,มหาเมฆสูตร,,30,
The Great Commentary on the Abhidharma,อภิธรรมมหาวิภาษาศาสตร์,,"7,14, 37, 62",
The Great Diligence Sutra ,มหาวิริยสูตร,,47,
the great heavenly king Brahmā,,Daibonten（大梵天）,,
The great king Udayana,พระเจ้าอุเทนมหาราช ,,17,
The Great Lecture Hall,หอไตรหลวง,,2,
the Great Medicine King Tree,ต้นมหาไภษัชยราช,,30,
The Great Nirvana Sutra,มหานิรวาณสูตร,,,
the great precept ,มหาศีล,,37,
The great ruler Emperor Antoku,จักรพรรดิอันโทขุ,,105,
The great star of the Five Garrisons,,,2,
the Great Teacher Chishō ,พระมหาธรรมาจารย์จิโช,,8,
The Great Teacher Dengyo,พระมหาธรรมาจารย์เด็งเงียว,,258,
The Great Teacher Kōbō ,พระมหาธรรมาจารย์โคโบ,,15,
The Great Teacher Kompon,พระมหาธรรมจารย์คมปง,,13/ 14,
The Great Teacher Miao-lo,พระมหาธรรมจารย์เมียวลัก,,"3, 43",
The Great Teacher Nan-yueh,ปรมาจารย์หนานเยี่ย / พระมหาธรรมจารย์หนานเยี่ย,,"39, 89",
The Great Teacher T'ien-t'ai,พระมหาธรรมาจารย์เทียนไท้,,258,
the Great Teacher T’ien-t’ai Chih-che ,พระมหาธรรมาจารย์เทียนไท้ผู้ทรงปัญญา,,"10,66",
The Great Wisdom Sutra,มหาปรัชญาปารามิตาสูตร,,2,
The Heart of Abhidharma,อภิธรรมหฤทัยศาสตร์,,11,
The Heart of the Middle Way (See Bhāvaviveka),,Chūgan-shin-ron （中観心論）: ,,
the heaven of long life,อวิหาภูมิ,,8,
the heaven of the thirty-three gods,สวรรค์ชั้นดาวดึงส์ ,,38,
the heavenly gods and earthly deities,เทพบนสวรรค์และเทพปฏพี,,110,
the higest stage of perfect enlightenment,ขั้นอนุตรสัมมาสัมโพธิญาณ,,47,
the hundred million characters,อักษร 100 ล้านตัว,,8,
"the icchantikas, or persons of incorrigible disbelief",อิจฉานติกหรือผู้ไม่เลื่อมใส,,8,
the immediate attainment of perfect wisdom,การบรรลุปัญญาสมบูรณ์ทันที,,8,
the intercalary first month of this year,เดือนอธิกมาสเดือนที่ 1 ของปีนี้,,16,
the intercalary tenth month,เดือนอธิกมาส 10 / เดือน 10 อธิกมาส (รอเช็ค),,128,
