Vocab,ไทย,Japanese,gosho number,
inferior manifested body,"
อนุนิรมาณกาย",retsu-ōjin （劣応身）: ,30,
... are themselves ...,ก็คือ,,47,
"""Nine Pieces” of Elegies of Ch’u by Chu Hsi of the Sung dynasty ",“9 บทเพลง” ของ บทกวีไว้อาลัยแห่งฉู่ โดยฉู่ซีแห่งราชวงศ์ซ่ง,,38,
"""the Law of the one vehicle” of Buddhahood",“ธรรมะแห่งเอกพุทธยาน”  ,ichi-butsujō,41,
doctrine of the three vehicles,คำสอนแห่งตรียาน,,66,
"among the sutras, among all the sutras","ในบรรดาพระสูตร, ในบรรดาพระสูตรทั้งหมด",,88,
Kissen Shishi,โกลิตะคาม,,98,
so that,เพื่อให้ เพื่อ เพื่อที่ว่า ดังนั้น จน จนกระทั่ง (เก็บไว้เลือกใช้),,123,
there is abosolutely no fault on my part.,อาตมาไม่มีความผิดใดเลย,,123,
"
Wonderful Laws / -- mystic law
ธรรมหัศจรรรย์ ไม่มีสระ อะ

wonderful Laws ธรรมะมหัศจรรย์ - มีสระอะ","ธรรมมหัศจรรย์ ไม่มีสระอะ ถ้า W, L เป็นตัวใหญ่  / ส่วน w ตัวเล็ก แอลใหญ่ มีสระอะ คำว่า ธรรมะ (ของธรรมะมหัศจรรย์)",,123,
requital,บุญคุณ,,123,
urge,กำชับ,,123,
great king great ruler,มหาราชา,,123,
"When a great sword is exposed to even a small fire, it ceases to be of any use",เมื่อดาบใหญ่โดนไฟก็ใช้ไม่ได้ (ref: จาก ธรรมบท),,88,
T’ien-chien era (C.E. 506),ยุคเทียนเจียน ปีที่ 5 (ค.ศ. 506),,88,
secular texts,ตำราทางโลก,,"66, 88",
minor king ,"2025-04-26 minor king, petty ใช้ว่า อนุราชา / great king ใช้ว่า มหาราชา, มหากษัตริย์",,127,
petty king,"2025-04-26 minor king, petty ใช้ว่า อนุราชา / great king ใช้ว่า มหาราชา, มหากษัตริย์",,123,
great lecture hall,หอเทศนาธรรมใหญ่,,88,
Universal and Impartial Enlightenment Sutra ,,,110,
"Hui-kuan (368–438), Hui-yen (363–443), Seng-jou (431–494), and Hui-tz’u (434–490)","พระฮุ่ยกวน(#7,30) (ค.ศ. 368-438)  พระฮุยหยวน (ค.ศ. 363-443)  พระเซิ่งโหยว (ค.ศ. 431-494) และพระฮุยซื่อ (ค.ศ. 434-490) ",,88,
Commentary on the Universal Worthy Sutra,อรรถกถาสมันตภัทรสูตร,,88,
main hall,โถงหลัก,,"88, 95",
Great Lecture Hall of Enryaku-ji,หอไตรหลวงของวัดเอ็นเรียะขุจิ,,2,
Shōdai-nyo,โมคคัลลี,,98,
cry out in misery,ร้องตะโกนด้วยความทุกข์ทรมาน,,93,
heavenly messengers,ทูตสวรรค์,,"29, 93",
Profound Discourse on the Flower Garland Teachings,การพิจารณาเกี่ยวกับคำสอนอวตังสก,,97,
had to suffer at the hands of the Mongols,ต้องทนทุกข์เพราะพวกมองโกล,,93,
Nikkō’s List of Disciples upon Whom Nikkō Bestowed the Gohonzon,รายชื่อลูกศิษย์ที่พระนิกโคมอบโงะฮนซนให้ ของพระนิกโค,,98,
“appropriating Buddhism” or “plagiarizing Buddhism.”,“การฉกฉวยพุทธธรรม” หรือ “การขโมยพุทธธรรม.”,,30,
“nature” you spoke of itself lacks anything that can be called a nature,สนะีห,,30,
all desires will be fulfilled,สมหวังตามที่ปรารถนาทุกประการ,sho gan man zoku,90,
linked by deep karmic ties,เชื่อมโยงด้วยสายสัมพันธ์แห่งกรรมที่ลึกซึ้ง,,,
Golden Light and Sovereign Kings sutras ,สุวรรณประภาสสูตรและสุวรรณประภาโสตตมสูตร,,87,
"แม้ไม่มีใครเห็น
แต่ก็บากบั่นสุดกำลังเพื่อความสุขของมิตรสหาย
การอุทิศตนเช่นนี้มีบุญกุศลนับไม่ถ้วน
จงเชื่อมั่นใน
""การรับรู้ของพระพุทระต่อสิ่งที่แฝงอยู่""*
และมีชีวิตอยู่เพื่อภาระหน้าที่ที่สูงส่งจนถึงที่สุด
จาก ดร.ไดซาขุ อิเคดะ
นสพ. เซเดียว วันที่ 23 มิถุนายน ค.ศ 2023","*การรับรู้ของพระพุทธะต่อสิ่งที่แฝงอยู่"" มีความหมายว่า พระพุทธะ โพธิสัตว์ และเทพธรรมบาลทั้งหลาย มองเห็นและรู้ถึงจิตใจและพฤติกรรมทั้งปวงของทุกคน แม้จะไม่ได้แสดงออกอย่างเปิดเผยก็ตาม จากแด่เพื่อนของข้าพเจ้า  23 มิย 2023   ---- ฝากใส่คลังศัพท์ไว้
และเพราะ
ไม่รู้ น้องๆ ที่แปล เนื้อหา ประจำวันเหล่านี้ เขาเข้าถึงคลังศัพท์ของเราด้วยหรือเปล่าคะ  เคยแปลว่า   
คุณความดีที่มองไม่เห็น 

ภายหลังแปลว่า
กุศลแฝง

เดี๋ยวนี้แปลว่า
สิ่งที่แฝงอยู่",,,
Former Han Dynasty,ใช้ได้ทั้ง 2 คำ (ราชวงศ์ฮั่นตะวันตก = ราชวงศ์ฮั่นตอนต้น),,88,
"The Commentary on the Ten Stages Sutra, also known as the Dasabhumika Sutra, is a Mahayana Buddhist text that describes the ten stages of bodhisattva development. In this sutra, the Buddhas of the ten directions are described as follows:

    North: Buddha Vishvapani
    South: Buddha Ratnaketu
    East: Buddha Akshobhya
    West: Buddha Amitayus
    Northeast: Buddha Shakyamuni
    Northwest: Buddha Maitreya
    Southeast: Buddha Mahaprabha
    Southwest: Buddha Lokesvararaja
    Above: Buddha Vairochana
    Below: Buddha Prabhutaratna

It's important to note that the names and associations of the Buddhas of the ten directions may vary depending on different Buddhist traditions and texts.","ในศาสนาพุทธไม่มีพระพุทธเจ้าที่เกี่ยวข้องกับทิศทั้ง 10 โดยเฉพาะ อย่างไรก็ตาม ในบางพุทธประเพณี พระพุทธเจ้าหรือพระโพธิสัตว์ซึ่งเป็นตัวแทนของคุณสมบัติหรือคำสอนที่แตกต่างกันอาจเกี่ยวข้องกับทิศทั้ง 10 ตัวอย่างเช่น ในศาสนาพุทธนิกายมหายาน รายการทั่วไปของ 10 ทิศและพระพุทธเจ้าหรือพระโพธิสัตว์ที่เกี่ยวข้องคือ:

ทิศเหนือ - พระอักโษภยะหรือพระวัชรปาณิโพธิสัตว์
ทิศตะวันออกเฉียงเหนือ - พระรัตนสัมภวะหรือพระสมันตภัทรโพธิสัตว์
ทิศตะวันออก - พระอมิตาภพุทธเจ้าหรือพระปัทมปานีโพธิสัตว์
ทิศตะวันออกเฉียงใต้ - พระอวโลกิเตศวรโพธิสัตว์
ทิศใต้ - พระอโมฆสิทธิพุทธเจ้าหรือชัมบาลาโพธิสัตว์
ทิศตะวันตกเฉียงใต้ - พระศรีอาริยเมตไตรยหรือพระศากยมุนีพุทธเจ้า
ทิศตะวันตก - พระอมิตาพุทธเจ้าหรือพระโพธิสัตว์มหาสถัมพร
ทิศตะวันตกเฉียงเหนือ - พระไวโรจนะหรือพระโพธิสัตว์อักษะรภะ
จุดสูงสุด - พระอักโษภยะหรือพระโพธิสัตว์มัญชุศรี
นาดีร์ - พระพุทธธรรมกายะหรือพระพุทธธรรมกายะ

โปรดทราบว่าสมาคมเหล่านี้อาจแตกต่างกันระหว่างประเพณีและสำนักต่างๆ ของพุทธศาสนา และบางสำนักอาจไม่มีความเกี่ยวข้องเฉพาะเจาะจงกับทิศทั้ง 10 เลย เจ้าค่ะ.
-----
Q5  จาก alisa (line app ห้องโงโช)",,127,
"The Lotus Sutra is the teacher of all the Buddhas of the ten directions and the three existences. The Buddhas of the ten directions are the Buddha Good Virtue in the east, the Buddha Sorrow-Dispelling Virtue in the southeast, the Buddha Sandalwood Virtue in the south, the Buddha Giver of Treasure in the southwest, the Buddha Infinite Brightness in the west, the Buddha Flower Virtue in the northwest, the Buddha Banner-like Virtue in the north, the Buddha Three Vehicle Practice in the northeast, the Buddha Vast Myriad Virtue of the zenith, and the Buddha Brilliant Virtue of the nadir.","

พระพุทธเจ้าประจำทศทิศ ประกอบไปด้วย 
1. ทิศตะวันออก คือพระพุทธเจ้ากุศลคุณ (善德佛)
2. ทิศตะวันออกเฉียงใต้ คือพระพุทธเจ้าปราศกังวล (无忧德佛)
3. ทิศใต้ คือพระพุทธเจ้ามีคุณดั่งไม้จันทน์หอม (旃檀德佛)
4. ทิศตะวันตกเฉียงใต้ คือพระพุทธเจ้าประทานสมบัติ (宝施佛)
5. ทิศตะวันตก คือพระพุทธเจ้ารัศมีไม่มีประมาณ (无量明佛)
6. ทิศตะวันตกเฉียงเหนือ คือพระพุทธเจ้าอริยคุณ (华德佛)
7. ทิศเหนือ คือพระพุทธเจ้าผู้มีรูปอันประเสริฐ (相德佛)
8. ทิศตะวันออกเฉียงเหนือ คือพระพุทธเจ้าผู้ทรงยานทั้งสาม (三乘行佛)
9. ทิศบน คือพระพุทธเจ้าผู้ไพศาลนานา (廣眾德佛)
10. ทิศล่าง คือพระพุทธเจ้าผู้มีคุณอันจำรัส (明德佛)
",,127,
simply intent upon speaking ill,มุ่งแต่จะให้ร้าย,,69,
The Later Collection of Gleanings,รวบรวมกวีนิพนธ์ญี่ปุ่นของจักรพรรดิ,,83,
first exposition,เทศนาครั้งแรก,,84,
unique and wonderful truth,เอกธรรมมหัศจรรย์,ichimyo,66,
ordination platform for universally administering the precepts of perfect and immediate enlightenment,อุปสัมปทาสถานสำหรับบรรพชาด้วยศีลแห่งความเพียบพร้อมสมบูรณ์และรู้แจ้งทันที,,66,
"(1) extraordinary changes of the sun and moon, (2) extraordinary changes of the stars and planets, (3) fires, (4) unseasonable floods, (5) storms, (6) drought, and (7) war","(1) การเปลี่ยนแปลงอย่างผิดปกติของดวงอาทิตย์และดวงจันทร์ (2) การเปลี่ยนแปลงอย่างผิดปกติของดาวฤกษ์และดาวเคราะห์ (3) อัคคีภัย (4) อุทกภัยผิดฤดูกาล (5) พายุ (6) ภัยแล้ง และ (7) สงคราม   
(พิบัติ 7 -- seven disasters)",,,
The Treatise on the Treasure Vehicle of Buddhahood ,รัตนโคตรวิภาคมหายาโนตตรตันตรศาสตร์,,66,
(Buddha's body) indestructible as diamond,กายพระพุทธที่แข็งแกร่งดุจเพชร,,4,
(d. 1221),(มรณะ ค.ศ. 1221),,38,
The Record of the Western Regions ,จดหมายเหตุการเดินทางสู่ดินแดนตะวันตก ,,83,
(King)Shuddhodana,พระเจ้าสุทโธทนะ,Jōbon-nō（浄飯王）,30,
(n.d.) = no date,วันเดือนปีไม่ปรากฏ,,30,
Sutra of the Collected Stories of the Buddha’s Deeds in Past Lives,มหาวัสตุอวทาน,,,
(to be) far advanced in practice,ผู้มีการปฏิบัติขั้นลึกซึ้ง,,27,
student envoy,ผูู้แทนนักเรียน,,83,
special envoy,ผู้แทนพิเศษ,,83,
1 fathom ,1 ฮิโระ,,12,
28 constellations,นักษัตร 28 หมู่,,2,
4 major offenses,บาปหนัก 4 ประการ ,,9,
7 guardian spirits,อสุรเทพผู้พิทักษ์ทั้ง 7,,2,
Buddha's remains,พระพุทธสรีระ,,70,
8 difficulties,อขณะ 8,,8,
"Chinese classic, Hsün Tzu",วรรณกรรมจีน ซุนจื่อ,,70,
A Brief Commentary on the Susiddhikara Sutra,สังคหอรรถกถาสุสิทธิกรสูตร,,72,
A Buddha’s three types of bodies,สามกายของพระพุทธะ,,127,
a cause-awakened one,ปัจเจกพุทธะ,,250,
A Clarification of the Precepts,นิยายเรื่องศีล,,30,
a cluster of blessings,กลุ่มก้อนของบุญกุศล,รินเอ็นงุโซขุ/ที่รวมบุญกุศล,101,
A Collection of Japanese and Chinese Poems for Singing,หนังสือรวบรวมบทกลอนภาษาญี่ปุ่นและภาษาจีนเพื่อการขับกล่อม,,13,
A Collection of Stories and Poems,หนังสือรวบรวมนิทานและบทกลอน,,49,
a comprehensive index of Buddhist texts in Chinese ,ประมวลนามานุกรมคัมภีร์พุทธศานาฉบับภาษาจีน,,13,
a decade or two,10 ปี 20 ปี,,8,
A doctrine of childish theory,หลักธรรมที่เป็นทฤษฎีเด็กๆ,,,
a heart of faith,จิตใจแห่งความศรัทธา,,8,
a high official of the Yamato court,เสนาบดีชั้นผู้ใหญ่ในราชสำนักยามาโตะ ,,10,
A History of the Buddha's Successors,ประวัติผู้สืบทอดของพระพุทธเจ้า,,"13,16,30",
a hundred blessings,ผลบุญ 100 ประการ,,,
"A Personal Commentary on “The Profound Meaning of the Lotus Sutra""",ปกรณ์ส่วนตัวเกี่ยวกับ “บทนิพนธ์อรรถถาสัทธรรมปุณฑริกสูตร”,,72,
"A History of the Buddha’s Successors, A",ประวัติผู้สืบทอดของพระพุทธเจ้า,Fuhōzō-innen-den （付法蔵因縁伝）: ,"13,16,30",
A History of the Transmission and Propagation of Buddhism in Three Countries (See Gyōnen),,Sangoku-buppō-dentsū-engi （三国仏法伝通縁起）: ,,
a hundred blessings,ผลบุญ 100 ประการ,,62,
a hundred thousand million Buddha lands to the west (See Western Pure Land),,saihō-jūman-okudo （西方十万億土）: ,,
a hundred yojanas,ร้อยโยชน์,,8,
a jewel of a boy child ,เด็กชายจากแก้วมณี,,19,
a jewel of a child ,รัตนบุตร,,19,
a jewel of wisdom,ดวงแก้วแห่งปัญญา,,17,
A later stage,ขั้นหลัง,,13,
a lay believer of the Pure Land school,ฆราวาสผู้ศรัทธานิกายสุขาวดี,,13,
a leper,คนโรคเรื้่อน,,30,
a man [in China],มีบุคคล [ในประเทศจีน],,129,
A non-Buddhist document,บันทึกนอกพุทธศาสนา,,101,
a person of sound belief,ผู้ที่มีความเชื่อที่ถูกต้อง,,17,
a person of virtue,บุคคลแห่งคุณงามความดี,,2,
"A Personal Commentary on Matters concerning Prince Shōtoku, A",อธิบายประกอบความคิดเห็นส่วนตัวเกี่ยวกับเรื่องราวของเจ้าชายโชโทขุ,,"30, 170",
a practitioner of the True Word school,ผู้ปฏิบัตินิกายมนตรยาน,,13,
A Priest Does Not Bow before a King (See Hui-yüan [1] ),,Shamon-fukyō-ōja-ron （沙門不敬王者論）: ,,
a priest of the Precepts school,สงฆ์นิกายวินัย,,13,
a priest of the Zen school,นักบวชนิกายเซน,,13,
a prophecy,คำพยากรณ์หนึ่ง,,93,
a ranking,ยศสูง,,116,
A Ship to Cross the Sea of Suffering,เรือสำหรับข้ามทะเลแห่งความทุกข์,,3,
A single Buddha possesses all three bodies. (See three bodies),,isshin-soku-sanjin （一身即三身）: ,,
a single moment of life ,หนึ่งขณะจิตของชีวิต/หนึ่งขณะจิต,,"1,13",
a single verse or phrase,คาถาหรือวลีเดียว,,13,
a single wish-granting jewel,จินตมณี 1 เม็ด,,250,
a sutra of perfection and fullness,พระสูตรเพียบพร้อมสมบูรณ์และครบถ้วน,,30,
a thousand world,หนึ่งพันโลก,,39,
a three-pronged diamond-pounder,วัชรตรีศูล,,"13, 68",
a wooden image,พระพุทธรูปไม้,,87,
a work of insignificant doctrines ,หลักธรรมกระพี้,,30,
Ababa hell (See eight cold hells),,Ababa-jigoku （阿婆婆地獄）: ,,
Abe no Sadatō,อาเบะ โนะ ซาดาโตะ ,,67,
aberration,,,93,
Abhayagiri monastery (See Southern Buddhism),,Muisen-ji （無畏山寺）: ,,
Abhayagiri school (See Southern Buddhism),,Muisenji-ha （無畏山寺派）: ,,
abhidharma,อภิธรรม,abidatsuma （阿毘達磨）: ,,
Abhidharma school,,Bidon-shū （毘曇宗）: ,,
superior to,ความเหนือกว่า,,66,
Abhirati,,Ahiradai （阿比羅提）: ,,
abhor,รังเกียจ,,"10, 15",
ability,พระปรีชา,,11,
abound,ดาษดื่น,,13,
absolute myō,,zetsudai-myō （絶待妙）: ,,
absolute superiority ,สถานะสูงส่งที่สุดอย่างแท้จริง,,8,
absurd ,ช่างไร้เหตุผล,,8,
Abuse,การทำผิด,,13,
abuse,ให้ร้าย,,59,
great demons ,เหล่าปีศาจร้ายกาจ,,69,
Abutsu-bō,ท่านอะบุ๊ดจึโบ,Abutsu-bō （阿仏房）,31/67,
Abutsu-bō Nittoku,ท่านอะบุ๊ดจึโบ นิตโตกุ,,31,
accept and uphold,รับและยึดถือ,,1,
accord,สอดคล้อง/ตรงตาม,,6,
according to ...,ตามที่ี่กล่าวอยู่ใน.... / ตามที่สอนอยู่ใน.(LS)...,,50,
according to the Sutra....,ตามที่ปรากฏอยู่ใน....สูตร,,39,
accords with others' minds,คล้อยตามจิตใจผู้อื่น,,11,
Accumulated Great Treasures Sutra,,Daihōshaku-kyō （大宝積経）: ,,
Accumulated Treasures Sutra,พระมหารัตนะกูฏสูตร,Hōshaku-kyō （宝積経）: ,37,
accumulates ,สั่งสม / สะสม,,9,
āchārya,,ajari （阿闍梨）: ,,
Acharya Ben,พระอาจารย์เบน,,"56,71",
Āchārya Yamato,พระอาจารย์ยามาโตะ,,49,
acquired enlightenment,,shikaku （始覚）: ,,
actual evidence,ข้อพิสูจน์ทางความเป็นจริง,,,
actual proof (See three proofs),ข้อพิสูจน์ที่เป็นจริง,gen-shō （現証）: ,30,
actual three thousand realms in a single moment of life (See three thousand realms in a single moment of life),หนึ่งขณะจิตสามพันทางด้านความจริง,ji-no-ichinen-sanzen （事の一念三千）: ,40,
ādāna-consciousness,,adana-shiki （阿陀那識）: ,,
adaptations of the Law expedient means (See three expedient means),,hōyū-hōben （法用方便）: ,,
address ,บอก สั่งสอน,,7,
addressed to ,มอบให้แก่,,,
addressing someone,,,9,
adherents,"ผู้ศรัทธา (10,61) ผู้ยึดถือ (13) เหล่าสานุศิษย์ (30,63)",,,
Administator of Priests Jien,พระสังฆาธิการจิเอ็น,,105/38,
administered the affairs of state ,บริหารราชกิจ,,39,
administrative center,ศูนย์บริหารงานราชการ,,82,
administrator of priests,พระสังฆาธิการ,sōjō （僧正）: ,72,
Administrator of Priests Danna,พระสังฆาธิการดันนะ ,,35,
Administrator of Priests Jien,พระสังฆาธิการจิเอ็น,,38,
admirable,น่ายกย่อง,,100,
Admirable Nichiro,ท่านนิชิโรผู้น่ายกย่อง,,26,
admonish,ตำหนิ,,13,
admonitions,คำตักเตือน,,105,
Adorned with Pure Light (See “Bodhisattva Wonderful Sound” chapter),,Jōkōshōgon-koku （浄光荘厳国）: ,,
advent,อุบัติ,,"7, 9",
advent,อุบัติขี้นมา,,24,
Advent of Maitreya Sutra (See Earth Repository),,Miroku-geshō-kyō （弥勒下生経）: ,,
adversity,,,,
advocates of the Nembutsu,ผูู้ยึดถือนิกายสุขาวดี,,62,
after my passing ,หลังจากเราเข้าสู่ความดับ,,"16,30",
agada,",",akada （阿伽陀）: ,,
Āgama,,Agon （阿含）: ,,
Āgama period,,Agon-ji （阿含時）: ,,
Āgama sutras,อาคมสูตร,Agon-gyō （阿含経）:,"7,8,11,12",
Agastya,,Akada-sen （阿竭多仙）: ,,
age of attaining liberation (See five five-hundred-year periods),,gedatsu-kengo （解脱堅固）: ,,
age of building temples and stupas (See five five-hundred-year periods),,tazō-tōji-kengo （多造塔寺堅固）: ,,
age of fear and evil,ยุคแห่งความกลัวและความชั่วร้าย,,"27,30",
age of meditation (See five five-hundred-year periods),,zenjō-kengo （禅定堅固）:,,
age of quarrels and disputes,,tōjō-kengo （闘諍堅固）: ,,
"age of reading, reciting, and listening (See five five-hundred-year periods)",ยุุคแห่งการอ่าน สวดท่อง และฟัง,dokuju-tamon-kengo （読誦多聞堅固）: ,66,
